{
  "schema": "lapart.harness-manifest.v2",
  "name": "cursor",
  "display_name": "Cursor Universal Adapter",
  "harness_version": "source-contract-2026-09-03",
  "adapter": {
    "language": "python",
    "entrypoint": "cursor_adapter.py",
    "class": "CursorAdapter",
    "sdk_version": 2
  },
  "protocol_versions": [1, 2],
  "operations": {"mode": "all", "include": [], "exclude": []},
  "capabilities": {"streaming": true, "tools": true, "skills": true, "mcp": true, "memory": true, "retrieval": true},
  "configuration": {
    "config_reference": "recipient://cursor/config",
    "data_reference": "recipient://cursor/data",
    "authentication": null
  },
  "lifecycle": {"initialize": "initialize", "shutdown": "shutdown", "readiness": "readiness_signal", "rollback": "rollback_signal"}
}
